{
  "schema_version": "1.0.0",
  "$schema": "https://raw.githubusercontent.com/eva01/qs-data/master/schemas/strength_group_list.schema.json",
  "category": "timber-strength-group",
  "data_type": "strength_group_list",
  "source": {
    "url": "https://quantitysurveyoronline.com.my/timber-strength-group.html"
  },
  "data_date": "static",
  "extracted_at": "2026-05-09T23:58:07Z",
  "row_count": 4,
  "quality_flags": [],
  "rows": [
    {
      "group": "A",
      "species": [
        "BALAU",
        "BALAU, RED",
        "BITIS",
        "CHENGAL",
        "GIAM",
        "KEKATONG",
        "KEMPAS",
        "KERANJI",
        "MATA ULAT",
        "MEMPENING",
        "MERTAS",
        "NYALAS",
        "PENAGA",
        "TUALANG"
      ]
    },
    {
      "group": "B",
      "species": [
        "KAPUR",
        "KELEDANG",
        "KERUING",
        "KULIM",
        "MENGKULANG",
        "MERAWAN",
        "MERBAU",
        "MERPAUH",
        "MINYAK BEROK",
        "PERUPOK",
        "PUNAH",
        "RENGAS",
        "RESAK",
        "TEMBUSU"
      ]
    },
    {
      "group": "C",
      "species": [
        "BINTAGOR",
        "DURIAN",
        "GERUTU",
        "KEDONDONG",
        "KUNGKUR",
        "MACHANG",
        "MEDANG",
        "MELANTAI",
        "MELUNAK",
        "MEMPISANG",
        "MERANTI,BAKAU",
        "MERANTI, DARK RED",
        "MERANTI, LIGHT RED",
        "MERANTI, WHITE",
        "MERSAWA",
        "PENARAHAN",
        "RAMIN",
        "SEPETIR",
        "SIMPOH",
        "TABAN MERAH",
        "TERAP"
      ]
    },
    {
      "group": "D",
      "species": [
        "DAMAR MINYAK",
        "GERONGGANG",
        "JELUTONG",
        "PULAI",
        "SESENDOK",
        "TERENTANG"
      ]
    }
  ]
}